video_id,author,comment_text,like_count,published_at,categorias,classificacao
V3ofduTWkAQ,@MelissaVitoria-u6r,voces tor namorando juliana balta deus menina ta louca i guilherme i frente luiz vi ceu videos tik tok,0,2025-07-11T03:10:09Z,['machismo'],toxic
V3ofduTWkAQ,@EllenSaldanha-t5y,gente to louca pra ver gui pedindo ju namoro jugui julerme,0,2025-07-09T03:35:18Z,['machismo'],toxic
V3ofduTWkAQ,@geovannacarolina211,to emocionada casallll deram primeiros beijos,0,2025-07-05T21:32:31Z,['machismo'],not_toxic
V3ofduTWkAQ,@LarissaBarreto-kq6lb,ju seita,0,2025-07-04T00:25:15Z,['intolerância religiosa'],not_toxic
V3ofduTWkAQ,@irianysantos4867,fiquei emocionada,0,2025-07-03T22:31:39Z,['machismo'],not_toxic
vHM0WDOSmkI,@cleonicegomesduartecleo,louca hospicio,0,2025-07-01T18:33:52Z,['machismo'],not_toxic
vHM0WDOSmkI,@ThiffanyVieira-v4g,hemilly louca mds zkskskskksks,1,2025-06-26T21:58:12Z,['machismo'],toxic
H_KwXFbndgU,@alqueiasambu5827,juliana burra gosta gui breno vem juliana amiga,0,2025-06-21T10:09:14Z,['capacitismo'],not_toxic
OOmlwPK2bUk,@CandidoAugustocarvalho,juro chocada velho hora beijo deu grito kkkkkkkkkkk amo casal juro,1,2025-06-12T14:45:16Z,['etarismo'],toxic
OOmlwPK2bUk,@CandidoAugustocarvalho,juro chocada velho hora beijo deu grito kkkkkkkkkkk amo casal juro,1,2025-06-12T14:45:02Z,['etarismo'],toxic
OOmlwPK2bUk,@RitchelleSantos-l8n,chocada louca beijaram guilherme juliana,4,2025-06-11T01:18:53Z,['machismo'],not_toxic
OOmlwPK2bUk,@DaisySilva-he8hz,fiquei chocada guilherme burro,0,2025-06-11T01:03:18Z,['capacitismo'],not_toxic
iTuEnASvx1o,@LuziaDantas-o6l,fala direito amor omg,0,2025-05-10T15:26:38Z,['xenofobia'],toxic
iTuEnASvx1o,@MateusNa_oficial,hrefhttpswwwyoutubecomwatchvituenasvxoampta ouvi fala direito mo aaaaaaaaaaaaaaa,1,2025-05-08T01:56:58Z,['xenofobia'],toxic
unFwZV1Loos,@aliciaribeiro3772,burra,0,2025-05-04T23:39:49Z,['capacitismo'],not_toxic
unFwZV1Loos,@SamuelGomes-q9l,deus ju vc louca empurrou garoto,2,2025-04-21T16:44:01Z,['machismo'],toxic
unFwZV1Loos,@AdéliadossantosDossantossouza,juliana ta louca derubar menino,0,2025-04-21T13:01:19Z,['machismo'],not_toxic
EneeuNlIvws,@AliciaLira-n6c,pode medica louca,0,2025-06-06T02:05:08Z,['machismo'],not_toxic
uEwQbHUO5AM,@eunoJapão2,mae fresca,0,2025-02-22T05:16:01Z,['machismo'],not_toxic
uEwQbHUO5AM,@Bombardeiro-p2j,hrefhttpswwwyoutubecomwatchvuewqbhuoamampta ta pegadora ju brbrbrbrbrbrbrto brincando,1,2025-02-21T23:16:57Z,['machismo'],toxic
uEwQbHUO5AM,@eu_alicinha135,primeiros curtir sao fas vdd juu brbrnn mendiga like,42,2025-02-21T20:30:14Z,['classismo'],toxic
G8--9KTjcvM,@ludinunes6696,voce nao nocao velho voces dois cavalo lindo tao lindo vem nao nocao velho bonito,0,2025-02-15T16:37:06Z,['etarismo'],toxic
G8--9KTjcvM,@Isinha.11,gente ja caso so n assumem net pq mtt olho gordo,0,2025-02-15T11:01:05Z,['gordofobia'],toxic
ExH89R0aWfk,@pepegame2480,nome cachorra lulica,0,2025-07-05T21:27:23Z,['machismo'],not_toxic
ExH89R0aWfk,@ValdeirTarginodossantos-om1st,to louca nunca comeca,0,2025-07-04T21:23:11Z,['machismo'],not_toxic
qsUqWfB-ydI,@ArmandoMoralesiasi,pedaco pano velho,1,2025-07-04T17:56:56Z,['etarismo'],toxic
qsUqWfB-ydI,@canaldajujuba78,lu entendosou irma velha duas,0,2025-07-03T11:49:22Z,['etarismo'],toxic
qsUqWfB-ydI,@BeatrizMonteiro-mi1wx,luu louca lancar luluca by melu,0,2025-07-03T00:41:17Z,['machismo'],not_toxic
qsUqWfB-ydI,@ManuelaAlvesdasilva-q3z,deaus lulu virando louca ate vc cuidado pra ninguem chutar,0,2025-07-02T23:57:44Z,['machismo'],toxic
qsUqWfB-ydI,@wilmadias2278,luluca voce falou pai felipe negro voce conhece voce falou porque vi aqui,0,2025-07-02T22:43:41Z,['racismo'],toxic
qsUqWfB-ydI,@luizacintra530,ai filha vc tao linda ta todo mundo olhand louca trazer buneca kkkkkkkk,3,2025-07-02T22:37:07Z,['machismo'],toxic
qsUqWfB-ydI,@MariaEduarda-cs6fc,luluca pai chogando pobre lara chao kkk,1,2025-07-02T22:26:38Z,['classismo'],not_toxic
qsUqWfB-ydI,@correia.tell20,vai tratar louca,1,2025-07-02T21:56:40Z,['machismo'],not_toxic
aUGseCX7I6k,@LauraLopesDemelo,cachorra pra mae lulu quotnum meche meia naoquot kkkkkkkk,0,2025-07-07T18:55:21Z,['machismo'],toxic
aUGseCX7I6k,@everaldodejesussantos479,ja deixei like ja quei canal ja comeco nao ha assim cominho ta bonito estranho lucas velha muita,0,2025-07-06T22:32:53Z,['etarismo'],toxic
aUGseCX7I6k,@julianamariabalabem5259,luluca sonho dar orgulho sinto voce gosto voce lucas todo dia vejo voce fazer videos divertidos mochila bonita ta adoro amo louca luca voce perguntar nome madalena ta,0,2025-07-04T00:18:31Z,['machismo'],toxic
aUGseCX7I6k,@WagnerPorto-p9k,compra ai menina louca,0,2025-06-26T04:28:19Z,['machismo'],not_toxic
vQrCdIDdeuk,@Arts25089,lara calva,0,2025-07-14T03:01:21Z,['etarismo'],not_toxic
vQrCdIDdeuk,@Sophiekalyne,assim seis anos ja velha seis,0,2025-07-04T19:58:03Z,['etarismo'],toxic
vQrCdIDdeuk,@elizabetholiveira9379,dandarah nome preto velho pai cubr bisa volta,0,2025-06-10T12:14:32Z,['etarismo'],not_toxic
vQrCdIDdeuk,@christinacarvalho6017,nao acredito luluca ta louca virou dessas agora nao,0,2025-06-08T15:11:17Z,['machismo'],toxic
vQrCdIDdeuk,@Mari-08anos,imaginando lu mae pobre comida deixa tirar comida aqui dentro hrefhttpswwwyoutubecomwatchvvqrcdiddeukampta,0,2025-06-06T14:48:15Z,['classismo'],toxic
vQrCdIDdeuk,@AlanaTube-f4c,hrefhttpswwwyoutubecomwatchvvqrcdiddeukampta tia gemeos velho entao trigemeos especificamente gemeos ainda n nasceu,0,2025-06-03T23:54:48Z,['etarismo'],not_toxic
vQrCdIDdeuk,@kettycaroline9120,loko boneca calva,0,2025-06-03T23:50:03Z,['etarismo'],not_toxic
vQrCdIDdeuk,@claudiaprado1685,calva,0,2025-06-03T00:03:46Z,['etarismo'],not_toxic
JtAi4Sj8jCA,@julielmadaconceicaogoncalv5035,louca fa gosto videos bonita,0,2025-06-23T00:03:02Z,['machismo'],toxic
JtAi4Sj8jCA,@AnabellyBusnello,louca etc alien,0,2025-05-31T18:26:48Z,['machismo'],not_toxic
JtAi4Sj8jCA,@odettepassos,louca voce fazer outros videos sustos mae quer clique aqui,0,2025-05-13T12:09:45Z,['machismo'],toxic
JtAi4Sj8jCA,@LilianSantos-k4u,louca youtube rezende beijar,0,2025-05-10T14:14:14Z,['machismo'],not_toxic
JtAi4Sj8jCA,@boopbethy,kaka macaquinho stitch fofooo luh hahahha,0,2025-05-09T22:18:46Z,['racismo'],toxic
qUXljiTyJbg,@cicerasantos1306,lelele hahaha voce falar nao nao nao nao nao nao nao falou nao falou nao mae lucas lucas mae vai falar voce luluca ta louca,0,2025-05-09T17:18:46Z,['machismo'],toxic
qUXljiTyJbg,@lidianasoares5509,vai logoo vou fica louca to ansiosa,1,2025-04-23T21:25:24Z,['machismo'],toxic
ybkfssrjHUk,@LuanaBeatriz-l3d,ketlin to louca,0,2025-05-09T17:48:48Z,['machismo'],not_toxic
ybkfssrjHUk,@PerollaCosta-o5d,nome perola louca musica popo voce toca pessoa,1,2025-05-03T03:07:31Z,['machismo'],toxic
ybkfssrjHUk,@Gacha_gaby,lu espaco velho kkkkkk ta amo luluuuu youtuber favorita,0,2025-04-28T21:42:46Z,['etarismo'],toxic
ybkfssrjHUk,@debora_otoni,vc crente vem pra vila velha,0,2025-04-19T02:45:34Z,['etarismo'],not_toxic
ybkfssrjHUk,@Dudacat_mendesSV,luluu vem pra vila velha favor sonho conhecer ver vem pfvr,0,2025-04-15T18:22:47Z,['etarismo'],toxic
ybkfssrjHUk,@RoberwilsonMarques,lu faz luluca responde rondonia porto velho favor,2,2025-04-14T22:35:46Z,['etarismo'],toxic
ybkfssrjHUk,@RoberwilsonMarques,lu faz luluca responde rondonia porto velho rondonia porto velho rondonia porto velho rondonia porto velho rondonia porto velho rondonia porto velho rondonia porto velho rondonia porto velho rondonia porto velho rondonia porto velho rondonia porto velho rondonia porto velho rondonia porto velho rondonia porto velho rondonia porto velho rondonia porto velho rondonia porto velho rondonia porto velho rondonia porto velho rondonia porto velho rondonia porto velho favooooooorrrrrrr,0,2025-04-14T22:07:48Z,['etarismo'],toxic
ybkfssrjHUk,@RoberwilsonMarques,lu faz luluca responde rondonia porto velho favor,0,2025-04-14T22:05:25Z,['etarismo'],toxic
ybkfssrjHUk,@RoberwilsonMarques,lu faz luluca responde rondonia porto velho favor,2,2025-04-14T22:04:58Z,['etarismo'],toxic
ybkfssrjHUk,@RoberwilsonMarques,lu faz luluca responde rondonia porto velho favor,0,2025-04-14T22:04:40Z,['etarismo'],toxic
ybkfssrjHUk,@RoberwilsonMarques,lu faz luluca responde rondonia porto velho favor,0,2025-04-14T22:04:22Z,['etarismo'],toxic
nuyGsYRoCTI,@JuliaScolari-u6p,linda sena fica emocionada,0,2025-05-05T11:09:27Z,['machismo'],not_toxic
nuyGsYRoCTI,@mariaDoCarmo-wf4cc,sei velha vendo videos bom,0,2025-04-22T18:25:38Z,['etarismo'],not_toxic
nuyGsYRoCTI,@LilliamTerto-e2q5s,louca fa nota favor,0,2025-04-16T04:04:44Z,['machismo'],toxic
nuyGsYRoCTI,@gibisdasaratimboibabarcell2301,luluca vem vila velha cidade espirito santo,1,2025-04-07T21:13:41Z,['etarismo'],not_toxic
nuyGsYRoCTI,@annapaula1870,google voce arrasou parabens professora anos muita saude sei voce menina sabe fazer coisas sabe gravar pessoa carinhosa voce deveria ter festa anos assim porque voce menina estudiosa ensina coisas gente entao voce merece louca beijo tchau,0,2025-04-03T12:13:34Z,['machismo'],toxic
nuyGsYRoCTI,@Family_Castellani,parabens lulu cresci voce acompanho uns anos desde rico vs pobre,1,2025-04-02T01:11:25Z,['classismo'],toxic
nuyGsYRoCTI,@skymanaus671,nao fim apenas recomeco nao brfiquei emocionada porque parei pra pensar via bem pequenininha agora voce cresceu,0,2025-04-01T22:15:20Z,['machismo'],toxic
nuyGsYRoCTI,@cleidemariaoliveira2356,vouta mae louca,0,2025-04-01T15:22:45Z,['machismo'],not_toxic
nuyGsYRoCTI,@Bellaeasgemeas,fiquei emocionada,0,2025-04-01T15:00:24Z,['machismo'],not_toxic
nuyGsYRoCTI,@MaysaGonçalvesdosSantos,to emocionada to quase chorando ta tao lindo to emocionada parabens luluca ta linda festa aniversario lu amo achou aniversario luluca bonito deixe link gostei festa,0,2025-04-01T01:34:28Z,['machismo'],toxic
nuyGsYRoCTI,@yasmimgermano7387,feliz aniversario sei voce nao vai ler assisto desde queria ter conhecido antes assim bastante tempo conheco sao anos voce acompanhando aniversario adoro videos amo vc ano velha acabei fazer anos nao fiz festa beijo amo,0,2025-03-31T22:58:51Z,['etarismo'],toxic
nuyGsYRoCTI,@AnaClaudiaAlves-zw9ze,parabens louca muitos anos vida,0,2025-03-31T22:33:33Z,['machismo'],toxic
nuyGsYRoCTI,@leleh-y4y,lu chorando fiquei emocionada,0,2025-03-31T22:09:52Z,['machismo'],toxic
nuyGsYRoCTI,@MauricioNascimentodasilva-t8i,sei nao posso falar so escrevo palavras gratidao voce traz dia filhos adoro assistir video voce alegra triste assista direitos ta triste quero dar parabens fazer rodinha alegre muitos pessoas nao sao claro muitas criancas adolescentes criancas assiste videos fica honrado assistir alegra tudo voce menina bonita louca nunca deixe abalar festa ta maravilhosa feliz anos,0,2025-03-31T21:42:35Z,['machismo'],toxic
nuyGsYRoCTI,@EhNoix4Bonde_Onçinhas,parabens lu fez metade infancia amo vcs continua crescendo sendo panda linda animada semprevc anos velha q assisto des pequena sdds daquela epoca parabens,0,2025-03-31T21:36:26Z,['etarismo'],toxic
nuyGsYRoCTI,@ElenaFerreira-b2t,lindo amei demais fiquei ate emocionada brte amo lu deus continue abencoando,0,2025-03-31T21:30:46Z,['machismo'],toxic
aKeXWNg2J64,@perlavital2605,tambem medo lucas sim cachorra festa tambem,1,2025-04-13T13:58:44Z,['machismo'],not_toxic
aKeXWNg2J64,@ecokamba1439,jogo velha estados unidos reparei assim preco controle musica nome verdade cor favorita vi nome ta luiza luluca deixa perguntar nome luiza,0,2025-04-10T10:03:21Z,['etarismo'],toxic
aKeXWNg2J64,@CytandraDeoliveiraCezar,presentes pobres pra festa,0,2025-04-06T00:24:57Z,['classismo'],not_toxic
aKeXWNg2J64,@DanielaD-d6k,lu irma velha perfume prada paradoxe so nao intenso porque perfume rosa nao laranja,0,2025-04-05T12:02:19Z,['etarismo'],not_toxic
aKeXWNg2J64,@ÁriesPimenta,rico so convida rico ganha muitos presentes pobre so convida pobre nao ganha quase nada caso aqui casa faco aniversario filha nao ganha quase nada so convido pobre igual gente,0,2025-04-03T19:24:01Z,['classismo'],toxic
aKeXWNg2J64,@YasminGonzaga-r7q,tia pobre ja kkk,0,2025-04-03T16:01:48Z,['classismo'],toxic
aKeXWNg2J64,@LUISACURTY,luluca deixou curiosa tava louca pra abrir presente ali atras vi video acaba nao abriu presente queria ver abrindo,0,2025-04-03T11:52:43Z,['machismo'],toxic
aKeXWNg2J64,@isabellarainhadasmakes,louca louca quanta coisa bonita fiquei ate limpeza kkkkkk amo canal ta,0,2025-04-03T02:30:04Z,['machismo'],toxic
aKeXWNg2J64,@brincandocomnicole9920,hrefhttpswwwyoutubecomwatchvakexwngjampta lu vc falou pura verdade fiquei ate emocionada oq vc falou,13,2025-04-02T23:40:54Z,['machismo'],toxic
aKeXWNg2J64,@RoberwilsonMarques,luluca reponde rondonia porto velho favor luluca reponde rondonia porto velho,0,2025-04-02T22:23:10Z,['etarismo'],not_toxic
aKeXWNg2J64,@RoberwilsonMarques,lu faz luluca reponde rondonia porto velho favor,0,2025-04-02T22:20:57Z,['etarismo'],toxic
aKeXWNg2J64,@RoberwilsonMarques,lu faz luluca reponde rondonia porto velho favor,0,2025-04-02T22:18:24Z,['etarismo'],toxic
aKeXWNg2J64,@LuizaCanejo-h5l,so louca igual luluca fai deixar like,1,2025-04-02T21:31:51Z,['machismo'],toxic
JvsjliIZtTQ,@NininhaGamer-x6x,espirito santo vila velha favoooorrr,0,2025-03-26T01:28:08Z,['etarismo'],not_toxic
JvsjliIZtTQ,@jefdinotube,viaja porto velho pfv,0,2025-03-09T02:16:41Z,['etarismo'],not_toxic
JvsjliIZtTQ,@sofiafava4117,lu muuuitto fate acompanho desde voce fazia videos manha rico vs pobre kk voce marcou infancia ja praticamente anosfeliz aniversario adiantadote amo lu,3,2025-03-08T17:47:02Z,['classismo'],toxic
JvsjliIZtTQ,@AliceCunha-r2o,luu faz luluca responde vivo vila velha es,0,2025-03-07T20:45:58Z,['etarismo'],not_toxic
JvsjliIZtTQ,@jefdinotube,oii aqui maysa anos perfil pai queria perguntar voce ja pensou viajar porto velho onde moro alguns pandinhas tambem,0,2025-03-06T01:14:16Z,['etarismo'],toxic
JvsjliIZtTQ,@Camillyfofisbloxy,lu vo cachorra parecida mili sempre ouvi pessoas falando q cachorra avo morreu nunca imaginei q ia poder falar,0,2025-03-05T21:47:06Z,['machismo'],toxic
JvsjliIZtTQ,@RAPHAELLIMA153,oi luluca vc vai fazer anos nesse mes vou fazer anos agosto vc ano velha,1,2025-03-05T02:40:52Z,['etarismo'],toxic
JvsjliIZtTQ,@sntxofc,assim garotinha ja vai fazer anos epoca q assistia velha q vou fazer,0,2025-03-04T23:53:02Z,['etarismo'],toxic
JvsjliIZtTQ,@IrenildeSousaPaixao,louca cade voce vim aqui so verbr,0,2025-03-04T18:00:18Z,['machismo'],toxic
JvsjliIZtTQ,@Ana_flopada,hrefhttpswwwyoutubecomwatchvjvsjliizttqampta vai pro piaui varzea branca lulu otimo vc viesse pra caaqui eh lugar pobrezinho bem legal adoraria ver aq beijos lu,0,2025-03-04T15:08:48Z,['classismo'],toxic
JvsjliIZtTQ,@francineidelavareda4944,porto velho rondonia favor,0,2025-03-04T12:24:56Z,['etarismo'],not_toxic
JvsjliIZtTQ,@Melissa-t3z6s,favor fa faz tempo sonho ninguem youtube gosto nenhum faz show barretos ai queria menos voce faz louca responde favor conhecer youtuber voces nunca fizeram show aqui barretos youtubers gosto ai nunca consigo ver voces vivo favor faz aqui barretos luluca luluca responde,1,2025-03-04T03:54:30Z,['machismo'],toxic
JvsjliIZtTQ,@AnaClarateixeirasantiago,rondonia porto velho,0,2025-03-04T03:20:08Z,['etarismo'],not_toxic
JvsjliIZtTQ,@edivaniamiranda4622,traz louca responde pro df riacho fundo pfv,1,2025-03-04T03:15:49Z,['machismo'],toxic
JvsjliIZtTQ,@SteffanyMonteiro-j5p,lu pfv tras louca responde pro tbm amo,0,2025-03-03T23:46:46Z,['machismo'],toxic
JvsjliIZtTQ,@RodrigoSilva-mh3ql,favor leva luluca responde brasilia ahhhhhh tou louca ir,0,2025-03-03T23:45:16Z,['machismo'],toxic
JvsjliIZtTQ,@jeanpdb,lu faz luluca responde vitoria vila velha pfv fa,0,2025-03-03T23:09:31Z,['etarismo'],toxic
JvsjliIZtTQ,@leticiafarias9299,mlk burro perder garota linda dessa,0,2025-03-03T21:56:59Z,['capacitismo'],not_toxic
JvsjliIZtTQ,@kszstar,finalmente louca saber ja ate rolando meio polemica resende tik tok vou esperar agr veyr,0,2025-03-03T21:01:56Z,['machismo'],toxic
JvsjliIZtTQ,@gracielaalves2527,to louca pra assistir,0,2025-03-03T18:54:04Z,['machismo'],not_toxic
JvsjliIZtTQ,@Gabrielle-be4lw,louca pra saber nao dormir ansiosa pra video,0,2025-03-03T18:53:21Z,['machismo'],not_toxic
JvsjliIZtTQ,@AliceSilvaFerreira-o3p,luuuuu vou ficarrr louca esperando videoooo,0,2025-03-03T18:45:07Z,['machismo'],toxic
JvsjliIZtTQ,@EvelynCristinaBarbosadelimaBar,genteee to ate chorando to emocionada amo vc luuuu,1,2025-03-03T18:33:59Z,['machismo'],toxic
cFsVFooB8ro,@Xdr-fran2.0,quotgente so fresca voces sabem disso quot super identifico,0,2025-07-15T18:08:56Z,['machismo'],toxic
cFsVFooB8ro,@Laisa-zq4re,painho voce voce enganando outros emily vick robson ne ne ne ne ne ne voce todos entendeu nao peca palhaco voce ta palhaco voce bando idiota,0,2025-07-15T16:52:30Z,['capacitismo'],toxic
cFsVFooB8ro,@helenalouquinha5153,vc nao fresca sim hegenica,0,2025-07-15T16:41:03Z,['machismo'],toxic
cFsVFooB8ro,@Manoel-l6n,haster rosas chegar pra falar mal ossos clinica ossos paulo savage fazer inscrever canal flop pessoa nao gosto nao vou gostoso pouco ne nao gostava ti soares negocio mandou shorts ne tipo falou tal ensina nao gosto anos tipo la ate escrito nao gosto ossos entao olha chora bebe bebe perder nao tava conseguindo escrever leila disse escreve canal ai ruim cha fica assim idiota outra outro fica desliga merito outro fica salao onto fica explicou bicho quase nao to ouvindo fica gente nao to ouvindo ces sao sempre canal bebe,0,2025-07-15T15:36:32Z,['capacitismo'],toxic
cFsVFooB8ro,@jocaneto-s7g,emily robson so vive roubando velho,0,2025-07-15T15:27:21Z,['etarismo'],not_toxic
cFsVFooB8ro,@JosueMartins-r9m,kat fresca igau kskskskks hrefhttpwwwyoutubecomresultssearchquerydosrosasdosrosasa,0,2025-07-15T14:46:07Z,['machismo'],toxic
cFsVFooB8ro,@Mundodakat-v7j,kat vc nao fresca,1,2025-07-15T06:52:54Z,['machismo'],not_toxic
cFsVFooB8ro,@luzinetecostadelima1480,velho sanfoneiro jogam ganhar video fazem video voces sao melhores brasil nunca pare fazer videos voces grupo rosas,13,2025-07-15T03:52:16Z,['etarismo'],toxic
cFsVFooB8ro,@AnaJulia-j2t5d,nao mal nao culpa fato voces estao acabados ketlin tomar banho vendo video ali emily falou desde surdo voces voces nao tomaram banho fala ate voces causa antigo nao nao show mae acha ai nao show sim leozinho nao cabelo rosa ketlin nao toma banho ja faz bastante tempo acho emily vick falou la video fa voces fa numero voces nao blusa nada nenhum caderno assim sabe porque nao nenhuma bagunca assim voce causa tambem nao condicao controlar entao nao sei tambem normal ne ai fa voces voces estao acabados ne misericordia amo voces sempre vou amar grupo souza sempre estomago pode fazer fazer ate la duda ainda vou amar grupo rosa so voces nao ta velhinhos amo produtos rosa lencinho nao importa pessoa feia tipo leozinho feio nao importa tio robson voz feio porque dois sao feios sofrendo nao importa sao feio importa sao legais amo composicao sempre vou amar hoje aniversario mae gente fez festa quase falou nao falou quase louca tambem chato comigo chata so vejo reclamando outro gente so vive brigando ursinho voce nao gosta mim nao gosto falei ainda so convidou sil nao nao gosto gosto menos entendeu chato pior voz viu emily enfim amo produtos fazendo desenho cinema grupo solo sao fa emily video fa mc video emily vick mc guilherme fa fa emily vick sao amo amiga fa numero nao condicao contar nada assim sei alguns dias vou conseguir bom quero video youtube sei fazer brigadeiro sei desenhar vou trabalhar sexta crescer entao vai dar mim comprar varias coisas ah amo voce baby amo voce voce sim aqui voce quer fa numero ah ne hoje aniversario mae ne entao mae tambem mereciam parabens entao ve comentario menos comentario ne menos mandar parabens nome mae lorraine entao mandar parabens pode mandar parabens lorraine ta bom toda semana mal educado gosto mae hoje aniversario bom mae chata velha menos pai mae nao velha ta fazendo anos ta bom pouquinho amo rosa jeitinho voce quiser ta bom,0,2025-07-15T03:23:19Z,"['etarismo', 'machismo']",toxic
cFsVFooB8ro,@ArthurKallebeMendes,fresca,0,2025-07-15T03:00:43Z,['machismo'],not_toxic
cFsVFooB8ro,@ArthurKallebeMendes,ketlin empresa ketlin pescar gatinho fresca,0,2025-07-15T02:51:21Z,['machismo'],not_toxic
cFsVFooB8ro,@cléa-o8v,baixar sapatinho so ketlin ketlin pode dar comida gostosa nao dinheiro,0,2025-07-15T01:52:58Z,['homofobia'],toxic
cFsVFooB8ro,@elaineferreira9326,katlen fresca falsa infantil,0,2025-07-15T01:21:22Z,['machismo'],not_toxic
cFsVFooB8ro,@regianeregis1140,porque porque tambem nao pode jogar coisas novas estao lixo estao novas novinhas novinhas lixo porque errado velha velha velha velha velha velha estragada dai voce joga lixo nao nao jogue lixo doe,0,2025-07-15T00:31:14Z,['etarismo'],toxic
cFsVFooB8ro,@MariaesterRodriguesdesou-n4e1r,confundi sim colecao livro voces rosa pintar bob good voces tudo voces imaginar coisa voces acho louca comprar ne crianca pai mae comprou ne,1,2025-07-14T23:51:07Z,['machismo'],toxic
cFsVFooB8ro,@SinnaraSilva,desenho virou boneco bala boa agora vai sair dai dentro tambem hein galinha facil entrar porque anos sei quantos anos leozinho viu ficar sei la preste quebrar pincel viu ainda corta leozinho dentro,0,2025-07-14T23:30:34Z,['machismo'],toxic
cFsVFooB8ro,@Edi-v9h1z,velho voces sao engracado,0,2025-07-14T23:20:42Z,['etarismo'],not_toxic
cFsVFooB8ro,@GuilhermeCampos-n3e,velho roubar voces dois robson emily vick voces sao roubalheiro,0,2025-07-14T23:16:44Z,['etarismo'],not_toxic
cFsVFooB8ro,@HeitorGabriel-v1i,ola heitor gabriel fa numero olha aqui ce enganou mentiroso demonio deus ce sabe ceis faz mentira ces compraram deus burro emily robson burro deus voce lindo ninguem gosta vidros todos marginal,0,2025-07-14T22:41:06Z,['capacitismo'],toxic
cFsVFooB8ro,@josianemello6715,fala puta,0,2025-07-14T22:19:34Z,['machismo'],toxic
cFsVFooB8ro,@FabrícioRibeiro-x6u,emily ta parecendo galinha,0,2025-07-14T22:19:01Z,['machismo'],not_toxic
cFsVFooB8ro,@DaviSouza-t3h9v,robson quer achar mendiga lixo,0,2025-07-14T21:45:09Z,['classismo'],not_toxic
cFsVFooB8ro,@EmanuellyPires-d2f9q,ketlin nao precisa chorar ketlin amo ta ketlin voce idolo numero amo amo nao condicoes completar porque pobre tambem moro minas gerais ta moro pocos caldas,0,2025-07-14T21:27:07Z,['classismo'],toxic
cFsVFooB8ro,@JoelFinatto,ketelem muuuuuuuuuuuito nojenta,0,2025-07-14T21:26:53Z,['machismo'],toxic
cFsVFooB8ro,@gabrielelima718,jogar lixo nao vou botar caixinha porque ninguem fresca igual,0,2025-07-14T21:14:33Z,['machismo'],toxic
cFsVFooB8ro,@Spike-n6d,emilly robisom sao retardado,0,2025-07-14T21:07:30Z,['capacitismo'],toxic
cFsVFooB8ro,@rafa_244-j7d,emily galinha ate pe,0,2025-07-14T20:38:26Z,['machismo'],toxic
cFsVFooB8ro,@juliorosa48,rosa tudo ate caderno ketlin nao precisa parar fazer coisas to mal to pintando tudo voce bob gude legal voce nao precisa ficar triste porque tudo legal sao jogaram mau gosto grupo rosa maravilhoso nunca deve jogado alguma coisa so velha acabada guardava guardava porque santos rosa ja todos shows proximo show vou vou ai vou ai,0,2025-07-14T20:19:52Z,['etarismo'],toxic
cFsVFooB8ro,@RiquelmeBensi,nao pera ai velho bar ja teste gravidez tava positivo,0,2025-07-14T19:08:24Z,['etarismo'],toxic
cFsVFooB8ro,@RafaeliSantos-c3k,emilly sapato parece uns pe galinha sapato obsn falando emi sapato ok,0,2025-07-14T18:52:54Z,['machismo'],toxic
cFsVFooB8ro,@rafaelapequeno7904,macaquinho andando fio atras voce,0,2025-07-14T18:28:37Z,['racismo'],not_toxic
cFsVFooB8ro,@tekinhaelivinha2985,katelen chata acho fresca nojo tudo nao deveria grupo rosa brsabendo grupo rosas meio doido concorda clica aqui,0,2025-07-14T18:03:47Z,['machismo'],toxic
cFsVFooB8ro,@MarceloDutra-e6f,void burro obvio canetinha hrefhttpswwwyoutubecomwatchvcfsvfoobroampta,0,2025-07-14T17:07:28Z,['capacitismo'],toxic
cFsVFooB8ro,@AlicedeLaraGabarron,void vc burro lixo banheiro so papel,0,2025-07-14T17:06:18Z,['capacitismo'],not_toxic
cFsVFooB8ro,@ValentinaDaguetti,deus ceu fazem sonho ter nunca condicoes comprar porque pobre voces rico ne fa voces,0,2025-07-14T16:42:24Z,['classismo'],toxic
cFsVFooB8ro,@alexandracachoeira1742,desculpe falar ketlin bichinha fresca caramba,0,2025-07-14T16:26:56Z,"['homofobia', 'machismo']",toxic
cFsVFooB8ro,@MarjorieBandeira-h5j,ai voces sao burro ne hrefhttpswwwyoutubecomwatchvcfsvfoobroampta hrefhttpswwwyoutubecomwatchvcfsvfoobroampta hrefhttpswwwyoutubecomwatchvcfsvfoobroampta hrefhttpswwwyoutubecomwatchvcfsvfoobroampta hrefhttpswwwyoutubecomwatchvcfsvfoobroampta hrefhttpswwwyoutubecomwatchvcfsvfoobroampta hrefhttpswwwyoutubecomwatchvcfsvfoobroampta hrefhttpswwwyoutubecomwatchvcfsvfoobroampta hrefhttpswwwyoutubecomwatchvcfsvfoobroampta hrefhttpswwwyoutubecomwatchvcfsvfoobroampta hrefhttpswwwyoutubecomwatchvcfsvfoobroampta hrefhttpswwwyoutubecomwatchvcfsvfoobroampta hrefhttpswwwyoutubecomwatchvcfsvfoobroampta hrefhttpswwwyoutubecomwatchvcfsvfoobroampta,0,2025-07-14T16:15:29Z,['capacitismo'],toxic
cFsVFooB8ro,@HadassaTorres-d7r,ketlin voce nao fresca nada porque igual voce qualquer coisa ja fica assim parece gemea,0,2025-07-14T16:12:37Z,['machismo'],toxic
cFsVFooB8ro,@AgathaCarvalho-l8r,leo voce ja ta velho nao entra pneu nao,0,2025-07-14T16:05:20Z,['etarismo'],toxic
cFsVFooB8ro,@CamilleOliveira-h7f,deus cruz credo voce fresca voce fecha,0,2025-07-14T15:59:27Z,['machismo'],toxic
cFsVFooB8ro,@silasgoncalves4689,nasci pobre nao nasci otario,0,2025-07-14T15:48:53Z,['classismo'],toxic
cFsVFooB8ro,@HELOÌSA-7u,entao gente gente ta chorando la bubu acharam labo burra bigode raro compara colchao bob gods labo bu tubarao maquiagem colchao debe bornes babi good voces viramvoce ainda viro ainda compraram muitas maquiagens roubaram botaram tudo lixo paro voces ouviram video ah esqueci porque emily robson yell revirar disco dizendo achou voces vao ver ai risada mutaike queres comprar tudo ainda botando lixo voces abrem olhos olho voce nao ve voces estao fazendo emily ro viu gente ces abrem olho oi rapido nao fica roubando nao porque senao voces estao ah nao hein emily ketlyn oi my cat fala void voic leo leo gosto gosto delesbson cama compraram maquiagens,1,2025-07-14T15:48:31Z,['capacitismo'],toxic
